id	title	text	score
3450600	中国人寿河北省分公司推出“荣军保”	<p>中国保险报网讯【记者 李彬】</p><p>8月1日上午，河北省退役军人事务厅与中国人寿河北省分公司、中华联合财产保险河北分公司在石家庄国寿大厦举行《河北省拥军优抚合作协议》签约仪式。省退役军人事务厅党组书记、厅长兰保良，中国人寿河北省分公司党委书记、总经理王吉山，中华联合财险河北分公司党委书记、总经理程基山，10名获得二等功以上荣誉称号的退役军人代表等相关人员参加了本次签约仪式。会议由省退役军人事务厅程晓辉副厅长主持。</p><p>签约仪式上兰保良说，退役军人是党和国家的宝贵财富，是改革发展稳定的生力军。此次省退役军人事务厅与中国人寿签署拥军优抚合作协议，是认真落实中央以及省委、省政府决策部署，是完善退役军人优抚优待机制的具体行动，也是弘扬拥军优抚光荣传统、引导社会力量参与退役军人优待工作的有益尝试，将会为营造“让军人成为全社会尊崇职业”的良好氛围起到积极的推动作用。</p><p>王吉山在致辞中讲到，此次和退役军人事务厅的合作，对公司来讲，更多的是一份政治担当，一项央企责任，旨在让退役军人切实感受到“尊崇、荣耀、服务、关爱”。河北国寿依托全省11家市级分公司、170多个县区支公司、超过1300个城乡服务网点以及超过12万人的销售队伍，将为这次签约做好服务工作。公司秉承“成已为人，成人达己”的文化理念，在省委、省政府的大力支持下， 2018年公司市场份额稳居河北寿险公司第一位;全年为客户办理500万余次保单服务，举办1824场特色客户活动，服务客户314万人次，客户服务满意度99%，理赔赔付24.82亿，平均结案时长不到1.4天，每两分钟就有一笔赔款赔付，98%的案件在5天内完成赔付，公司有实力完成这次光荣的任务。此次公司专门设计了“荣军保”、“创业保”、“e家保”三保专属保障方案;同时“荣军窗口”优先服务、关爱到家8项特色服务以及“红色讲堂”传承红色基因共计三类八项“尊崇保”主题活动，让退役军人家庭和子女共享公司丰富的健康服务资源和文化服务资源，切实感受到央企保险企业的真情关爱。为确保各项保险服务工作到位，公司还专门成立了拥军优抚项目领导小组和服务小组。</p><p>王吉山告诉记者，公司在工作开展过程中，将切实坚持四个原则：一是公益原则。为全省荣获二等功以上的退役军人免费赠送“荣军保”，总保险金额1.25亿元。二是定制原则。方案专属定制，切实考虑了人群服务特点，切实做到优惠优先，全部方案均较市场大幅优惠，费率优惠最高至60%以上;三是宣传原则。专门制作了宣传服务手册，让更多的退役军人及家庭了解服务。四是服务原则。</p><p>中华联合财险河北分公司也为退役军人打造了20多项专属保险产品。通过用心服务，切实体现出政府和国企的亲情关爱。程基山表示，中华联合财险将积极践行“源于军队、服务军队”的理念，以高度的责任担当和专业的服务能力，与中国人寿一同扎实做好河北退役军人保险服务!</p><p>签约仪式后，还召开了由各市（含辛集、定州）、雄安新区退役军人管理局主管局（科长）以及中国人寿省、市分公司主管副总经理（经理）参加的专题工作座谈会。</p><p>据悉，这次河北保险机构牵手省级退役军人事务厅开展拥军优抚工作在全国尚属首次，将为营造“让军人成为全社会尊崇职业”的良好氛围起到积极的推动作用。</p>	4
2870261	头部险企热衷股权投资 与政策、转型等因素有关	<p>股权投资基金再次引发关注。</p><p>近日，中国人寿(601628,诊股)保险股份有限公司(下称“中国人寿”)接连披露两则关联交易信息公告，拟以59.5亿元对关联的私募股权投资机构进行投资。</p><p>据记者统计，自2018年至今，险企通过关联交易投资私募股权投资基金(有限合伙)的数量已超过20例。</p><p><strong>中国人寿拟掷59.5亿元投资股权</strong></p><p>中国人寿接连发布的两则公告显示，其拟掷合计共59.5亿元参与股权投资基金，该笔投资的对象涉及山东省新旧动能转换国寿高端装备股权投资基金合伙企业(有限合伙)(下称“山东基金”)、国寿广德(天津)股权投资基金合伙企业(有限合伙)(下称“广德基金”)。</p><p><img class="ke_img" src="http://xqimg.imedao.com/168860cd1f21464c3fea98bf.jpg" alt="empty"/></p><p>具体来看，广德基金首期募集资金20.01亿元，中国人寿作为有限合伙人认缴20亿元，关联方国寿置业认缴100万元。广德基金成立后，将由国寿资本投资有限公司(下称“国寿资本”)担任基金管理人。首期募集资金将用于投资航空工业集团的航空发展项目、混改项目、结构调整项目、科研院所转制项目、上市公司定向增发项目。</p><p>山东基金拟募资规模为50亿元，中国人寿及山东省政府引导基金作为合伙人，分别认缴39.5亿元、10亿元份额。基金普通合伙人国寿鑫创(山东)投资管理有限公司认缴0.5亿元份额。基金经营期限为8年，投资期5年，退出期3年。</p><p>记者注意到，中国人寿作为有限合伙人出资山东基金，国寿资本作为基金管理人，国寿资本的全资子公司国寿鑫创作为基金的GP。根据相关规定，中国人寿与国寿资本及国寿鑫创为银保监会、香港联交所及上交所监管口径下的关联方，故中国人寿与国寿鑫创构成共同投资的关联交易，与国寿资本构成基金管理的关联交易。</p><p>从两则公告中不难看出，中国人寿包括以下两条投资策略：</p><p>第一，和大型企业展开合作，借助大企业在相关领域的优势地位和项目资源，获得后期在特定领域的发展空间;</p><p>第二，对接地方政府，通过借助当地政府的项目资源，获得参与国企混改、债转股项目等的机会，并将投资重点转向战略新兴产业。</p><p>针对此次展开股权投资的原因以及之后的投资重点将放在哪些领域，《国际金融报》记者联系了中国人寿方面，但截至发稿，暂未收到回复。</p><p><strong>险资参与股权投资潜力大</strong></p><p>2018年以来，险企通过股权投资基金方式参与多类股权投资项目的情况在持续增多。</p><p>据记者不完全统计，2018年至今，险企通过关联交易投资私募股权投资基金(有限合伙)的数量已超过20例，主要涉及中国人寿、中国平安(601318,诊股)、太平人寿、泰康人寿等头部险企。</p><p><img class="ke_img" src="http://xqimg.imedao.com/168860cd396149c53fe2a5d5.jpg" alt="empty"/></p><p>记者梳理发现，险资的投资方向更多元化。例如，险企将资金投资于中国境内医疗、养老行业及大健康领域，以“互联网+”为代表的战略性新兴产业企业，航天科技(000901,诊股)产业，或是投资于产业前景良好、市场环境稳定、盈利模式成熟的消费、文化教育、旅游、娱乐传媒、影视、节能环保等行业。</p><p>事实上，险企借道基金进行股权投资的背后，与政策加持、险企转型等多因素相关。</p><p>对此，经济学家宋清辉在接受《国际金融报》记者采访时表示，头部险企最近接连进行股权基金投资，这可以视为一种发展趋势。</p><p>宋清辉指出，险企对关联私募股权投资机构进行投资，具有明显的优势。关联私募机构有自融及吸引外部资金的便利条件，也与险企急需拓展投资渠道之诉求相呼应。</p><p>“近年来，在政策面加大支持力度的背景下，险资与私募合作空间广阔。”宋清辉认为，未来，险资投资的新机遇主要将集中在养老社区、健康医疗等相关板块。</p><p>2018年10月26日，银保监会就《保险资金投资股权管理办法(征求意见稿)》公开征求意见。本次修订调整的主要内容是取消保险资金开展股权投资的行业范围限制，通过“负面清单+正面引导”机制提升保险资金服务实体经济的能力。</p><p>有业内人士对《国际金融报》记者表示，从保险资金的投资运用来说，当下既是机遇也是挑战。险企若能够将新机遇作为突破口，培育属于自己的新动能，将有可能重新界定险企在股权投资领域的地位。</p>	4
3294732	中国人寿巧妙举牌万达信息	<p>中国人寿巧妙举牌</p><p>万达信息</p><p>羊城晚报 陈泽云</p><p><img class="ke_img" src="http://xqimg.imedao.com/16b924ef0761a883fa90eb83.jpg" alt="empty"/></p><p>唐志顺 画</p><p>羊城晚报记者 陈泽云</p><p>近日，万达信息（300168）公告称，控股股东万豪投资、实际控制人史一兵与中国人寿6月23日签署了股份转让协议，拟转让公司5.0142%的股份。完成后，万达信息的第一股东将由万豪投资变更为中国人寿及其一致行动人（国寿集团、国寿资产），后者持股1.65亿股股份、占比15.0183%。自去年12月，中国人寿通过纾困产品“凤凰”率先持股万达信息，随后不断通过二级市场买入、股份受让等方式增持万达信息股权，总计耗资逾22亿元。</p><p>中国人寿成功入主万达信息</p><p>万达信息公告披露，控股股东万豪投资与中国人寿签署了《股份转让协议》，约定万豪投资向中国人寿以每股14.44元的价格协议转让万达信息非限售流通股份5000万股，总价款为7.942亿元，占万达信息总股本的5.01%。</p><p>本次权益变动前，万豪投资持有公司18.2871%的股份，为公司控股股东；中国人寿及其一致行动人合计持有公司10.0042%股份。本次权益变动后，万豪投资持有公司股份14558.88万股，占公司总股本的13.2729%，变更为公司第二大股东；中国人寿及其一致行动人持有公司股份164734175股，占公司总股本的15.0183%，成为公司第一大股东。</p><p>6月14日晚，万达信息发布重大事项停牌公告，称万豪投资正在筹划股权转让事项，拟为公司引入金融保险某国有企业战略投资方，拟受让方将通过此次交易成为公司的第一大股东。</p><p>如今，谜底揭晓，中国人寿成功入主。受此消息影响，6月24日，万达信息开盘即封涨停，截至收盘仍有逾18万手买单。6月25日，万达信息再涨3.30%，收报13.77元。</p><p>公告还显示，截至当前，国寿系不排除未来12个月内继续增持万达信息的股票。同时，承诺在本次交易完成后的12个月内，不转让本次权益变动所获得的股份。</p><p>巧妙举牌或为布局智慧城市</p><p>实际上，早在去年，中国人寿就已经“看上”了万达信息。去年12月，国寿资产纾困产品“凤凰”即以协议转让的方式斥资6.325亿元购买万达信息5500万股（约占总股本的5%），成为万达信息第三大股东。当时，万达信息在公告中披露，国寿资产增持万达信息股票，主要是看好行业和公司长期发展潜力，同时也是积极落实相关精神，服务实体经济。</p><p>今年4月4日，中国人寿相关账户再次增持公司3.98%股份，增持后中国人寿及其一致行动人合计持股比例上升至8.98%，逼近当时的第二大股东上海科技创业投资有限公司（9%）。4月4日至本次股权受让期间，中国人寿还曾增持过1%的公司股权。</p><p>令人玩味的是，在持股达到10%的再度举牌线时，中国人寿并未对外披露。原来，今年1月份发布的新规《深圳证券交易所上市公司回购股份实施细则》规定，上市公司计算已回购股份占公司总股本的比例时，总股本以公司最近一次公告的总股本为准，无须再减抠回购专用账户中的股份。而如果不考虑回购账户中的股份，本次权益变动前，中国人寿及其一致行动人合计持有万达信息股份为9.9808%，可谓是精准避开了举牌线，避免了因二级市场波动增加入主成本。</p><p>记者统计发现，中国人寿及其一致行动人对万达信息的“谋位”总共耗资超过22亿元。被国寿系看上的万达信息究竟有何来头？公开资料显示，万达信息是一家民生服务和智慧城市信息化行业的科技龙头企业，在城市信息化领域已有23年时间。</p><p>公告显示，本次交易完成后，中国人寿将在医疗健康、智慧城市、云计算、大数据等业务领域，以万达信息为主要平台整合科技资源和业务资源。公告透露，在智慧城市领域，将依托中国人寿长期的服务政府经验和上市公司全面技术能力，在一网通办、市民云、城市大脑和城市安全等领域深入布局。</p><p>（《中国人寿巧妙举牌万达信息》由金羊网为您提供，转载请注明来源，未经书面授权许可，不得转载或镜像。版权联系电话：020-87133589，87133588）</p>	4
3232653	野村：料税务优惠利好内险股 升中再保(01508)及国寿(02628)评级至“买入”	<p>智通财经APP获悉，野村发表报告，称财政部对内险新税务佣金扣除政策会利好利润较高的内险股，上调中国再保险(01508)及中国人寿(02628)评级，均由“中性”升至“买入”，予中国再保险目标价1.79港元，国寿为24.01港元。</p><p>报告指出，财务部公布提高保险公司手续费及佣金支出可税前抵扣的比例，其中财险公司由15%提高到18%，寿险公司由10%提高到18%。野村估计，2018年有效税率较高的内险受惠较大，国寿去年有效税率14.3%；中国平安(02318)为26.2%；中国太保(02601)为34.2%；新华人寿(01336)为24.6%；中国太平(00966)为32.7%；中国财险为33.9%。在人寿保险范围，高毛利定期寿险产品首年佣金相对，相信该类产品比重较商的寿险内企会最受惠，新政策潜在利好，支持野村较看好高毛利的内险股，如平安保险、太保及新华。</p>	4
3260376	中国人寿客户节升级四大服务板块	<p>中国保险报网讯【记者 朱艳霞】6月12日，中国人寿第十三届客户节启动仪式暨服务升级发布会在北京举行。据了解，本次服务升级除了优化业务流程和扩展服务内容外，还将以AI和大数据等技术应用升级“更通畅、更快捷、更智慧、更贴心”四大版块。</p><p>（图：发布会现场，中国人寿集团总裁袁长清，监事长陈方磊，副总裁刘慧敏、盛和泰、尹兆君、苏恒轩，中央纪委国家监委驻中国人寿纪检监察组组长李眈陆出席，中国人寿/供图）</p><p>中国人寿集团副总裁苏恒轩在致辞中指出，在“一个客户，一个国寿”理念指引下，中国人寿不断加大科技赋能、努力重塑服务体系，为客户提供更通畅、更快捷、更智慧、更贴心的高品质服务体验，以服务的卓越为公司赢得客户的口碑，以卓越的服务为客户赢得更加幸福美好的生活。</p><p>在服务更通畅方面，中国人寿围绕“一个客户，一个国寿”，进一步整合各子公司、各业务板块服务体系，着力推进“统一客户联络中心”、“国寿联盟”和“客户之声”项目建设，“统一客户联络中心”实现保险、投资、银行板块间，境内外间客户联络中心的互联互通;“国寿联盟”实现了客户端APP的互联互通、相互集成和相互跳转;“客户之声”平台更及时高效聆听客户声音，了解客户诉求和评价，畅通客户反馈渠道。</p><p>在服务更快捷方面，借助语音识别、图像识别、人脸识别、机器学习等多项技术应用，中国人寿不断提高保险服务的在线办理率和自动化处理率，持续强化线上服务供给，投保、保全、理赔等各个环节的服务效率大幅提升。例如，无纸化投保进单总量已突破1680万件，投保范围覆盖全球;“随心借”、“安心领”产品支持线上自助办理保单借款和满期金、红利、生存金领取，实现多保单一次性办理，大大简化了传统服务流程;与超过9000家医院实现数据对接，为客户提供瞬时赔服务;广发银行手机银行自助申请抵押简易、放款快速;通过多项服务升级为客户打造极速服务体验。</p><p>在服务更智慧方面，中国人寿依托金字塔大数据平台，应用智能语音、自然语义理解、深度学习、AI生物识别等技术，打造线上智能客服机器人e小宝，随时随地为客户提供产品信息、服务指南等各类服务;AI健康服务机器人为客户提供云端名医、体质自测等健康管理服务;柜面智能机器人为客户提供多种个性化服务;智测身价为客户提供保障需求测算服务;广发360智能资产配置为客户提供智能化专业资产配置建议;出险热力图，智能守护客户的生命与财产安全。</p><p>在服务更贴心方面，中国人寿加大服务供给，从健康、运动、救援、资讯、教育、生日关怀、贵宾礼遇等多个方面，为客户提供多元生活关怀服务。升级“国寿大健康”平台，为客户提供疾病自测、预约挂号、重疾绿通、急症救护等健康管理和就医服务;升级国寿700健行、健康万里行、e起健康行等服务，助力客户养成坚持运动的良好习惯打造有情感、有温度、丰富多元的客户服务新体验。</p><p>据了解，2019年国寿客户节将一直延续至10月份，中国人寿集团上下协同联动，在线上、线下开展九大类、超百项活动，涵盖了公益、文化、节庆、运动、健康、咨询等涉及客户生活的方方面面，全方位助力客户幸福升级。</p>	5
3261015	中国人寿下跌3%失守10天及20天线 首5月保费按年升5%	<p><img class="ke_img" src="http://i5.hexun.com/2019-06-13/197507904.gif" alt="empty"/></p><p>新浪港股讯，中国人寿（02628）现价下跌2.51%，报17.88元；成交约543万股，涉资9757万元．盘中低见17.86元，先后失守20天线（18.094元）及10天线（17.991元）。</p><p>国寿公布，今年首五个月，累计原保险保费收入3216亿元人民币，按年升4.72%。</p><p>现时，恒指报26925，下跌383点或下跌1.40%，主板成交162.18亿元。</p><p>国企指数报10361，下跌134点或下跌1.28%。</p><p>上证综指报2892，跌16点或跌0.55%，成交595亿元人民币。</p><p>表列同板块或相关股份表现：</p><p>股份（编号） 现价 变幅</p><p>------------------------------</p><p>中国人寿（02628） 17.88元 下跌2.51%</p><p>中国太平（00966） 19.62元 下跌1.90%</p><p>新华保险（01336） 34.85元 下跌1.13%</p><p>中人保 （01339） 2.98元 下跌1.65%</p><p>中再保 （01508） 1.37元 上升0.74%</p><p>中国平安（02318） 86.75元 下跌1.08%</p><p>中国财险（02328） 8.32元 下跌1.65%</p><p>中国太保（02601） 28.20元 下跌1.09%</p><p>众安在线（06060） 21.70元 下跌0.91%</p><p>------------------------------</p><p>（责任编辑： HN666）</p>	5
3471841	真爱！无惧两个跌停，中国人寿“痴心未改”二度举牌这只股票	<p>原标题：真爱！无惧两个跌停，中国人寿“痴心未改”二度举牌这只股票 来源：第一财经公司与行业</p><p>8月6日晚间，万达信息公告，2018年12月28日至2019年8月6日收盘，中国人寿通过二级市场增持公司股份5497.25万股，累计增持股份占公司总股本的5.0117%。持此，中国人寿持有10.0259%公司股份，成为第二大股东。</p><p><img class="ke_img" src="http://xqimg.imedao.com/16c6c22362041b53fe65875b.jpg" alt="empty"/></p><p>有意思的是，就在这次被举牌的前两天，万达信息因控股股东股份被冻结的利空消息连吃两个跌停，市值蒸发近22亿元。受这个消息影响，万达信息今天封死涨停板。</p><p>值得注意的是，6月24日万达信息公告，控股股东万豪投资及实控人史一斌与中国人寿签署《股份转让协议》，拟转让公司5.0142%的股份。但这一协议因为大股东掉链子而在7月24日突然终止。</p><p>问题来了，中国人寿在此刻举牌万达信息用意何在？</p><p>事实上，中国人寿想要入主万达信息的心早已路人皆知了，但其中的故事却比吃瓜群众要想的波折得多。</p><p>2018年12月，因监管层号召纾困上市公司，中国人寿与万达信息“结缘”，受让万达信息大股东所持5.0025%股份。2019年之后，又多次通过各种方式增持股份，其想成为万达信息的第一大股东之心逐渐显露出来。于是，又有了前面提到的股权转让协议签订但又终止的事情。</p><p>如今，在万达信息控股股东股份全部被司法冻结的危机时刻，中国人寿选择二度举牌，足见其对万达信息深沉的爱。</p><p>不过，这个世界上没有无缘无故的爱，中国人寿看上万达信息的背后颇有深意。</p><p>万达信息是国内领先的智慧城市整体解决方案提供企业，在医疗信息化方面处于领军地位，上市以后曾创造过股价的辉煌。但即使现在股价与业绩都每况日下，但中国人是还是看上了他，其在公告中写道：</p><p>“基于对万达信息及其所在行业的分析判断及充分论证，拟取得万达信息部分股权，充分发挥资源整合能力，实现国有资本的保值增值，提升对社会公众股东的投资回报。”</p><p>分析人士指出，双方业务协作可以从三方面进行：</p><p>短期来看，中国人寿与万达信息可以优势互补，在医保医疗科技、健康服务等领域合作。</p><p>中期来看，聚合万达信息在医疗健康领域积累的大数据和专业队伍能力，有望实现中国人寿数据驱动，创新发展。</p><p>长期来看，双方为医保医疗及健康保险、健康管理和服务提供完整、便捷的技术解决方案，提升核心竞争力。</p><p>但现在看来，即使中国人寿爱得深沉，万达信息的基本面也不甚乐观，营收净利双双下降，现金流极其不稳定，何时能够改善也是未知数。不知道未来中国人寿要如何给万达信息献上“玫瑰花”，帮助他重新好转起来。</p>	5
