id	title	text	score
3474054	百奥赛图获5.43亿元D轮融资 国寿大健康基金与国投创业领投	<p><img class="ke_img" src="http://xqimg.imedao.com/16c6f398dd34fb83fe5f0742.jpg" alt="empty"/></p><p>铅笔道8月8日讯，生物技术公司“百奥赛图”完成总额5.43亿元的D轮融资，由国寿大健康基金和国投创业领投，C轮投资方招银国际、本草资本，以及百奥赛图管理团队共同参与投资。</p><p>据称，本轮融资将主要用于市场开拓、产品研发和服务升级，以及抗体生产服务基地建设等领域。</p><p>资料显示，百奥赛图于2008年在美国创立，并于2009年在北京成立的综合性生物技术企业。目前已成长为提供生物药临床前一站式研发服务的综合性CRO公司，服务领域涵盖基因编辑模式动物定制服务、独立知识产权的疾病动物模型繁殖与供应、药理药效及PK/PD等临床前服务、以及抗体药物研发外包服务等。</p><p>据了解，百奥赛图在北京、上海、江苏海门、美国Boston等地设有子公司和分支机构，通过持续的研发投入，建立独特的具有独立知识产权的产品平台和研发服务平台，为全世界生物医药企业提供差异化的高质量的产品和服务。</p><p>创始人沈月雷表示，“我们坚持每年将相当比例的销售收入投入到研发中，近几年每年会递交100多项发明专利申请。我们为客户提供的所有动物模型都具有独立知识产权。我们坚信，持续的研发投入将是百奥赛图一直为客户提供差异化高质量的产品和服务的关键。合作实现共赢是我们坚守的信条，我们永远不会与客户去竞争。”</p><p>国寿股权投资有限公司董事总经理张蕾娣表示，“未来全球药物研发支出将持续增加，全球CRO行业将继续保持快速发展。百奥赛图作为国内生物医药CRO行业的领军企业，多年来持续研发投入，专注于打造一站式研发服务平台，并开发出全球领先的抗体全人源小鼠Renmab平台，将可以为全球生物制药公司提供综合性的研发服务。”</p><p>国投创业总经理高爱民表示，“国投创业连续参与了百奥赛图的B轮、C轮和D轮融资，见证了百奥赛图从基因编辑定制化服务起家，逐步发展为临床前一站式研发服务平台的历程。在当前的国内外形势下，投资人要有历史使命感，要有时代担当，我们将一如既往的支持百奥赛图，通过打造具有世界影响力的CRO公司推动中国生物医药产业的发展。”</p>	2
3295018	中国人寿集团机关党员干部赴中央档案馆接受“初心”教育	<p>在“不忘初心、牢记使命”主题教育开展之际，近日中国人寿集团公司机关党员干部代表在集团党委委员们的带领下，一行50余人赴中央档案馆接受“初心”教育。</p><p>据悉，中央档案馆保管着自“五四”运动以来，具有全国意义的革 命历史档案和中华人民共和国成立后党和国家中央机关的具有永久保存价值的档案。其中珍藏了大量领袖人物的手稿，是党和国家档案的精华，是我国新民主主义革 命和社会主义建设的历史见证。国家档案局局长、中央档案馆馆长李明华接待了中国人寿一行。</p>	2
3398756	结对帮扶洒真情——记中国人寿驻内蒙古乌兰察布大六号镇帮扶工作队	<p>原标题：结对帮扶洒真情——记中国人寿驻内蒙古乌兰察布大六号镇帮扶工作队</p><p>“在扶贫中，我们想方设法为帮扶对象脱贫着想，定期或不定期下乡到扶贫对象家里或扶贫对象单位进行走访慰问，详细了解他们的困难和需求，多措并举进行解决，力所能及之内，绝对不说空话，不留遗憾。”中国人寿保险股份有限公司（以下简称“中国人寿”）派驻内蒙古乌兰察布大六号镇扶贫的职工张军民说起扶贫，如数家珍。</p><p><img class="ke_img" src="http://xqimg.imedao.com/16c0907085246b83fec9f58c.png" alt="empty"/></p><p>今年62岁的张军民，原系中国人寿银行保险部的资深经理。2015年，张军民被公司派驻到广西崇左市龙州县进行扶贫，并担任下冻镇驮江村驻村第一书记。由于工作出色，2018年，年届退休的他被公司返聘并派驻到内蒙古乌兰察布市察右后旗，领衔担纲公司派驻工作队负责人。</p><p>中国人寿派驻乌兰察布扶贫工作队始终把扶贫对象当亲人，融真情实感，洒汗水，通过多项举措，不仅使结对帮扶取得了阶段性成果，而且让精准扶贫工作落地开花，赢得了群众的称赞。</p><p>因时而动，整治村容村貌</p><p>随着易地移民、小村整合、危房改造等项目深入实施，村容村貌整治工作需进一步推进。2018年，在大六号镇党委政府的配合下，中国人寿负责庙湾行政村的赵家坊自然村，南梁行政村的南梁自然村、王金自然村、芦草沟自然村，恒义隆行政村的恒义隆自然村，羊盘洼行政村的三道沟自然村，晨阳行政村的花土洼自然村、二明自然村、券窑洼自然村的拆迁整合。共拆除土房462户860间，拆除附房391户750间，拆除危旧30440延米及新建院墙15919延米，街巷硬化4674.2米。</p><p><img class="ke_img" src="http://xqimg.imedao.com/16c090709ab47b63f86748c1.png" alt="empty"/></p><p>2019年，进一步推进村容村貌整治。大六号镇羊盘洼行政村后半号自然村、前半号自然村、上二道沟自然村、下二道沟自然村、羊盘洼自然村，丰裕行政村的前街自然村、后堂自然村、二录自然村、小喜自然村，庙湾行政村的大德堂自然村，南梁行政村的王耀沟自然村，均列为拆建对象，共拆除土房385户941间，拆除附房719间，拆除危旧院墙2750延米，新建院墙9350米。</p><p>2019年，中国人寿协调察右后旗有关单位，新铺设道路11公里。与此同时，中国人寿将出资配套解决大六号镇农村生活垃圾和生活污水处理，提升村容村貌整体水平，建立符合农村实际的收运处置体系，补齐人居环境短板。初步拟定在大六号镇政府所在地附近建垃圾焚烧和污水处理厂一处，可解决1500户日产生垃圾及污水处理。</p><p>因地制宜，实施健康扶贫</p><p>为提升群众健康水平，解决群众“看病难”问题，防范因病致贫现象，中国人寿利用自身优势，对大六号镇实施健康扶贫工程。</p><p><img class="ke_img" src="http://xqimg.imedao.com/16c09070b2447273fd1e21b1.png" alt="empty"/></p><p>由中国人寿出资201万元，为大六号镇卫生院购置生化分析仪、DRX光机、彩超标配、三折医用床、尿液分析仪、五分类血球分析仪、心电图机及各类医疗器械设备。为674户1445人建档立卡贫困人员办理购药保险，为 4010名非贫困户办理大慢病保险，解决群众看病贵问题。同时，参照2018年度参保标准，2019年中国人寿继续为建档立卡贫困户和非贫困户办理健康保险。</p><p>因势利导，建构发展平台</p><p>为方便大六号镇各村易地移民搬迁群众和党员活动，中国人寿投入资金23万元，新建了集党员活动室、文化活动室、卫生室等功能于一体的阵地一处，配置电脑13台，打印机5台，复印机2台，一体机8台，LED条屏9个，LED大屏（2.7×3.6）1个。</p><p>为延伸产业链条，增加当地农产品附加值，中国人寿在丰裕村建设电商平台一处，扶持2000亩有机作物上线销售。同时，积极利用面粉粮油加工厂深加工，打造属地品牌，推进线上销售。在鸿达农牧业公司建电商平台一处，加大当地农产品销售力度。</p><p>因缘而合，做强集体经济</p><p>大六号镇拥有优越的地理位置及上万亩无污染土地，现有设施农业4.5万亩，旱地2.2万亩，可年产优质土豆6万吨、葵花2000吨、葱头1.2万吨、南瓜3000吨、小麦1500吨、莜麦750吨、胡麻700吨，但镇上缺乏大型的上市龙头企业带动。2019年，中国人寿利用自身有利条件，积极准备为大六号镇引进一家大型的上市涉农企业，期望形成“龙头企业+合作社+贫困户”的长效利益链接机制，推进产业化发展，实现稳定增收脱贫目标。同时，初步拟定投入500万元资金，在大六号镇晨阳行政村建2000吨储窑一座、在庙湾行政村建2000吨储窑一座，用于发展壮大村集体经济。全部收益归村民所有，并且覆盖全部贫困户。</p><p>大六号镇人民政府镇长任力说：“这几年，中国人寿为大六号镇做了很多实事好事。新建的电商平台帮助我们卖出了很多农副产品。健康扶贫盘活了我镇的卫生院。一系列举措的推进落实，大大加快了我们大六号镇脱贫攻坚的步伐。”这，就是出自于当地领导的肺腑之言，同时也是当地百姓的心声。</p><p><img class="ke_img" src="http://xqimg.imedao.com/16c09070c5347823fd6bc97b.png" alt="empty"/></p><p>久困于穷，冀以小康，这是中华儿女千年追求的梦想。在国家精准扶贫政策的惠及下，在中国人寿派驻干部职工的真情帮扶下，大六号镇的精准扶贫工作取得很大成效。帮扶对象的思想观念有了明显转变，生活水平也有了很大改善。中国人寿将继续采取得力措施，努力挖掘好、整合好、运用好各方面资源和力量，把产业扶贫与扶智、扶志相结合，变短期效果为可持续长期效应，让贫困群众真正脱贫致富，让百姓真正共享发展成果。</p>	2
2914535	上市险企今年将加大长期股权投资力度	<p>近期，中国人寿(601628,诊股)(港股02628)和新华保险(601336,诊股)(港股01336)发布了2018年度业绩预告。其中，中国人寿业绩预减，因为权益市场震荡下行导致的权益类投资收入大幅减少。目前，中国平安(601318,诊股)(港股02318)、中国太保(601601,诊股)(港股02601)、中国人保(601319,诊股)等上市险企尚未发布2018年业绩预告，但业内人士预计，受2018年国内资本市场整体震荡下行的影响，五大上市险企权益投资有不同程度的下降，导致整体投资收益承压。</p><p>分析人士表示，2019年，在监管部门鼓励险资增持优质上市公司股票政策陆续出台和资本市场估值处于相对合理位置的背景下，上市险企会考虑加大A股市场配置的力度。而且，在长端利率下行背景下，为提高投资收益，险企也会加大长期股权投资和基建方面的投资。</p><p><strong>上市险企投资收益下滑</strong></p><p>中国人寿发布的2018年度业绩预告显示，2018年归属母公司的净利润将同比减少50%-70%，主要因公开市场权益类投资收益同比大幅减少。川财证券分析师杨欧雯表示，中国人寿2018年前三季度投资收益已经出现同比15.54%的下降，而上证综指前三季度累计跌幅和第四季度跌幅均超过了10%，预计中国人寿去年第四季度的投资收益不容乐观，或产生较大亏损。</p><p>新华保险发布的2018年业绩预增报告称，该公司2018年实现归属于母公司股东净利润与2017年同期相比，预计增加26.92亿元左右，同比增加约50%；归属于母公司股东的扣除非经常性损益的净利润与2017年同期相比预计增加27.48亿元左右，同比增加50%左右。新华保险称，2018年年度业绩预计增长的主要原因是传统险准备金折现率假设导致2018年保险合同准备金提取减少。</p><p>“新华保险的业绩预增与其2018年总投资收益率无太多关联，权益市场波动可能令新华保险归母净利润同比增速有所下滑。”兴业证券(601377,诊股)分析师刘文强认为，2018年四季度资本市场的波动，一定程度将拖累新华保险的投资业绩。</p><p>东方金诚首席金融分析师徐承远指出，2018年A股市场低迷，上证综指累计下跌24.59%，险资青睐的蓝筹股亦扭头向下，如上市险企持仓的云南白药(000538,诊股)、工商银行(601398,诊股)(港股01398)、中兴通讯(000063,诊股)(港股00763)、神马股份(600810,诊股)等龙头股下行幅度较大。</p><p>“考虑到上市险企不同程度地配置了权益类资产，在权益市场整体低迷的情况下，权益类投资收入下降拖累2018年业绩的险企还包括中国平安、中国太保等。”杨欧雯表示。</p><p>“投资收益下滑，一方面是因资本市场低迷，另一方面，多家险企在2018年中期积极加大久期国债等固定收益资产的配置，下半年部分债券出现违约，也同样加剧了险企2018年总投资收益率的下滑。”杨欧雯说。</p><p>不过，徐承远称，“险企全年投资收益下降幅度相对有限”。保险资金投资风格整体较为稳健，债券、存款以及债权投资计划等固收类产品是险资投资的主要品种，权益类投资占比不高，虽然2018年下半年以来长端利率不断下行，但险企在去年一季度把握利率高位时机，新配置了不少收益率较高的固定收益产品，对其2018年投资业绩奠定了较好的基础。</p><p>平安证券分析师陈雯预计，保险行业2018年全年投资收益率在4.3%左右，为2013年以来的最低点。预计中国人寿全年总投资收益率为3.0%，太保与新华总投资收益率则分别为4.55%和4.5%。</p><p><strong>今年可能增配中长期资产</strong></p><p>2019年上市险企如何提升投资收益率？多家险企人士表示，负债端方面，2019年上市险企更着眼于全年保障型产品保费收入的稳健增长；投资端方面，2019年在市场流动性偏宽松的环境下，长端利率持续下行的可能性大，险资或更青睐收益相对较高的高级别长久期信用债、长期或超长期专项地方债、基础投资建设、长期股权等投资。</p><p>杨欧雯表示，由于保险资金的特殊性，加之信用收紧，保险资金的负债成本难以降低。在负债端，上市险企应当继续坚定回归保障本源的路线，同时不断优化产品结构，以久期拉长作为稳定负债端的主要战略。她说：“就投资端而言，在保费增速放缓的背景下，调整资产结构不可避免地成为2019年险企提升投资收益的主要方式。2019年险资或将重点放在中长期资产的配置上，同时受政策引导，其主要资产方向在原有基础上也将有所出新。比如参与到股权质押风险缓解中的股权投资，参与资本市场稳定中的非行业限制的权益类投资等，这些逐步放松的投资限制和逐渐丰富的投资品种都能够帮助险企分散风险，增加潜在收益。”</p><p>与此同时，债券、债权计划等固定收益产品仍然是险资的主要投资方向。</p><p>徐承远认为，随着保险行业回归保障产品和中短存续期产品停售，险企负债端期限被不断拉长，因此险资寻找超长期固收类匹配资产的趋势会持续，同时险资将进一步加大对高级别长久期信用债、长期或超长期专项地方债的挖掘。此外，在长端利率下行的前提下，为提高投资收益，险企也会加大对长期股权投资和基建方面的投资。</p><p>杨欧雯预计，在股权投资方面，在偏向长期股权配置的同时对于涉及股权质押的相对优质标的的投资力度可能会增强，政策放宽行业投资限制后对于前期未涉及行业的投资力度可能会增强；在固定收益投资方面，长期固收品种中对超长期专项地方债和国债的选择可能会有所侧重；而在不良资产处置方面，专业程度高且资金充足的大中型资产或存在直投的机会。</p><p><strong>A股板块配置将更加丰富</strong></p><p>由于政策的放宽和对收益率的追求，险企在A股板块的配置上会有所丰富和创新。一位险企人士透露：“在鼓励险资增持优质上市公司股票政策陆续出台和资本市场估值处于相对合理位置的背景下，上市险企会考虑加大A股市场配置的力度，以提高投资收益率和增强对实体经济的支持力度。”</p><p>川财证券分析师邓利军称，在保险资金加速流入阶段，A股市场整体表现相对强势。根据保险资金重仓股持股市值变动来看，2000年以来保险资金共有3次明显加速流入A股市场。历史数据显示，保险资金加速流入前后，A股市场表现相对强势。在2010年一季度、2014年四季度、2016年三季度至2017年四季度，这三个阶段前后，上证综指分别上涨约12%、59%和10%。</p><p>杨欧雯认为，对A股市场而言，目前满足条件的100多家险企将给市场带来增量资金，资本市场有望获得新鲜血液的注入。2019年险资比较倾向的领域可能遵循“科技赋能和稳增长”两个主要逻辑，把握国家战略和稳增长两个主要方向，其中侧重的板块可能包括科技产业、制造业（新能源汽车等）和消费产业（CRO、原研药、医疗器械）等。</p><p>“具体配置方面，险资一向青睐高派息率、业绩稳定增长的医药、房地产、金融、电气设备等行业的蓝筹股，而具有战略意义的新经济以及与保险业务有联动效应的养老、健康等领域也将是险资关注的重点领域。”徐承远道。</p><p>国寿资产相关人士表示，今年2月以来，A股市场迎来做多窗口。近期市场蓝筹再领风骚。随着商誉减值风险充分释放，中小创将触底反弹，叠加信贷阶段性高增、政策预期升温，流动性和风险偏好双双边际改善。行业方面，仍坚持两大主线：一是业绩确定的高景气板块，包括周期反转提前的生猪养殖，以及先进制造相关的新能源汽车、5G、集成电路行业；二是稳增长板块，主要是与基建相关的建筑、电力投资、轨道交通、机械，具有季度配置价值。</p>	2
2871905	广发银行总资产、营收双位数增长 2019年全面部署九大工作重点	<p>广发银行近两日举办的2019年全行工作会议，悄然勾勒了该行“三步走”战略发展路径以及2019年工作总体思路、重点攻坚任务。</p><p>自2016年中国人寿成为单一最大股东以来，在董事会和新一届党委、经营班子的共同努力下，广发银行优化战略定位，开启银保协同，加强资源整合和业务互动。中国人寿集团党委书记、董事长王滨指出，经过前两年固本强基，广发银行基本实现了“爬起来、站起来”的第一步；接下来要迈好“走起来、跑起来”的第二步，即实现持续、健康、稳健发展，在行业中持续赶超进位，主要经营指标显著提升，一些业务、产品和服务处于市场领先水平。第三步要“优起来、强起来”，进一步增强综合竞争实力，跻身股份制同业第一梯队，成为一家与中国人寿品牌形象相适应、具有重要影响力的全国一流商业银行。</p><p>王滨要求，广发银行要在加强党的建设的基础上，坚定战略自信，保持战略定力，全力开创高质量发展新局面。一是主动服务国家重大战略和发展大局。大力支持实体经济发展，坚决服务国家重大战略，创新普惠金融发展，助力打赢脱贫攻坚战。二是全力推进高质量发展。持续固本强基，进一步夯实管理基础。持续优化结构，进一步推动规模与效益的有机统一。持续改革创新，进一步激发高质量发展活力，以市场化导向深化体制机制改革，以管理模式创新激发经营机构活力，以金融科技赋能业务和管理创新。三是切实为重振国寿作出积极贡献。战略上加强对接，模式上加强创新，文化上加强融合。</p><p>广发银行党委书记、行长刘家德则代表广发银行党委、高管层作工作报告。刘家德总结2018年工作时指出，广发银行经营业绩大幅提升，管理基础进一步夯实：</p><p>首先，规模效益齐创新高，总资产、存贷款、营业收入等经营指标实现两位数增长；</p><p>其次，资产业务提质增效，优质客户占公司贷款比重明显提升，积极支持消费金融，全年新发信用卡超千万张，在银联跨行消费的市场份额稳居股份制同业第一梯队；</p><p>第三，银保协同纵深开展，重点协同项目加速推进，协同模式创新升级；</p><p>第四，经营转型加快推进，大力发展“双轻”业务，全面实施网点转型，积极探索数字化转型，大力优化业务流程；</p><p>第五．风险防控扎实有效，继续深入推进“三大工程”建设，切实提升资产质量，加强风险排查和整改，着力强化制度和系统建设，加大违规违纪问责处罚力度；</p><p>第六.差异化发展成效初显，引领分行的带动作用提升，重点分行经营情况改善，特色分行和稳健分行稳步发展。</p><p>刘家德还表示，过去一年，广发银行积极落实关于支持小微企业、打赢精准脱贫攻坚战等重大决策部署。小微金融服务方面，推出联合贷、政银通、政采贷、电商贷、法人按揭等重点产品，实行专项利率、专项考核、专项审批。精准扶贫方面，坚持金融扶贫、产业扶贫、就业扶贫多措并举，取得了阶段性成果。</p><p>刘家德全面部署了2019年重点工作：一是做大客户基础，推动负债业务“量”“质”双升；二是深化客户服务，推动资产业务高质量发展；三是大力发展“双轻”业务，提升价值创造能力；四是强化金融科技，提升客户服务能力；五是深化银保协同，打造综合金融强大优势；六是标本兼治精准施策，增强主动管控风险能力；七是深化机制体制改革，激发基层经营活力；八是强化党建引领，发挥国有金融企业政治优势；九是集中发力巡视问题整改，全面从严管党治行。</p>	2
3261091	港股异动 - 内险股疲软 中国人寿跌逾2%	格隆汇6月13日丨内险股走势疲软，中国人寿跌逾2%，中国太平、中国平安、新华保险等小幅下跌。<div><p><img class="ke_img" src="https://img3.gelonghui.com/0eab3-af92f05c-eee2-4718-945c-6dba36c3ced6.png?x-oss-process=style/wm" alt="empty"/></p><p>(行情来源：富途证券)</p><div>两家内险股昨日公布了运营数据，中国人寿1-5月原保费收入升4.72%至3216亿元；中国太保1-5月原保险业务收入增长7.2%至1726.45亿元。</div><div>另外，5 月 27 日，银保监会发布保险行业 4 月份经营情况。今年 1-4月，保险行业累计实现原保费收入 19059 亿元，同比+14.91%，其中财产险 3888 亿元，同比+7.08%，人身险 15172 亿元，同比+17.12%。4 月单月实现原保费收入同比+9.43%（去年同期为+17.40%），其中财产险同比+6.50%，人身险同比+11.08%。</div></div>	3
3091409	花旗：内险股寿险业务正复苏 首选国寿及平保	<p>格隆汇4月9日丨<span>花旗发表研究报告指，受惠于保障需求提升，不少内险股去年下</span><span>半年业绩均录得不俗表现，现时行业估值吸引，大部分市盈率0.56至0.69倍，首选</span><spanmicrosoft>中国人寿(02628.HK)</spanmicrosoft><span>及平保Ａ股。</span></p><p>花旗表示，去年下半年年，内险股的新业务价值(NBV)增长陆续恢复，<spanmicrosoft>NBV</spanmicrosoft>利润率亦<span>进一步提升，预料今年大部分内险股的</span><spanmicrosoft>NBV</spanmicrosoft><span>增长为5至10％，明年增长5至15％。</span><span>至于产险行业，该行维持审慎看法，因市场对于产险盈利恢复有过高期望，而近日内地爆发</span><span>猪瘟，以及江苏化工厂爆炸，将为产险行业的利润率带来压力。</span></p>	3
3091466	花旗：内险股新业务价值增长陆续回升 首选国寿(02628)	<p>智通财经APP获悉，花旗发表研究报告，得益于保障需求提升，不少内险股2018年下半年业绩均获得不俗表现，现时行业估值吸引，大部分市盈率0.56至0.69倍，<strong>首选国寿H股(02628)及平保A股(沪：601318)。</strong></p><p>花旗表示，去年下半年年，内险股的新业务价值(NBV)增长陆续回升，NBV利润率亦进一步提升，预料今年大部分内险股的NBV增长为5%-10%，明年增长5%-15%。</p><p>至于产险行业，该行维持审慎看法，因市场对于产险盈利恢复有过高期望，而近日内地爆发猪瘟，以及江苏化工厂爆炸，将为产险行业的利润率带来压力。</p><p>众内险股中，花旗给予国寿(02628)、平保(02318)以及太保(02601)等“买入”评级；给予中再保(01508)、新华(01336)及人保(01339)等“中性”评级。</p><p><img class="ke_img" src="https://img.zhitongcaijing.com/image/20190409/1554800552841600.png?x-oss-process=image/format,jpg/quality,Q_90" alt="empty"/></p>	3
