id	title	text	score
2889448	亚马逊官网惊现中国合作伙伴，CDN和云计算厂商又入蜜月期	<p><img class="ke_img" src="http://xqimg.imedao.com/168a19149c11f2253fa407bc.jpg" alt="empty"/></p><p>云计算王国间的合纵连横从未停止。</p><p>亚马逊AWS近期在官网上低调添加了一位合作伙伴，当用户搜索时会发现一个熟悉的名字——网宿科技，标注的是高级咨询伙伴（Advanced Consulting Partner），为AWS提供互联网内容分发与加速（CDN）、云计算、云安全、全球分布式数据中心等服务。</p><p><strong>AWS</strong><strong>官网里的中国合作伙伴</strong></p><p>AWS官网上所列举的网宿科技服务范围，已经超过了全球第一大的CDN公司——阿卡迈（Akamai ），后者主要为AWS提供的是CDN服务，而不包括网宿科技的云计算、云安全、全球分布式数据中心等内容。</p><p><img class="ke_img" src="http://xqimg.imedao.com/168a1914d591f2273fd221b7.jpg" alt="empty"/></p><p>从这点看，未来，网宿科技与AWS的合作具有巨大想象空间。IDC 2018全球CloudView 调研的数据则显示，81％的受访企业正在或计划使用公有云。Gartner预测，全球公有云服务市场将从2017年的1535亿美元，增至2018年的1864亿美元，涨幅达21.4%。</p><p>目前，据AWS官方介绍，包括三一重工、美的、海航、OPPO等各领域企业已经把数据和应用迁移到AWS平台上，AWS也在帮助更多的中国企业出海拓展国际业务。这意味着作为AWS的合作伙伴，网宿科技将收获更多潜在客户，拓展服务半径。</p><p>亚马逊AWS正试图把全球市场的荣光复制到中国。</p><p>国际数据公司 (IDC)此前发布的中国公有云服务市场半年度跟踪报告显示，由光环新网和西云数据运营的AWS市场份额超过6%，位列第四，排序比上年同期提前一位。虽然与阿里云依然存在巨大差距，但第三名的中国电信仅一箭之遥，二者市占率相差不到一个百分点。</p><p>考虑到IDC的统计口径主要是「由光环新网和西云数据运营的AWS中国区域」，如果把AWS中国客户的出海业务计算进来，AWS在中国的业务规模可能比现有的要大得多。值得注意的是，AWS的营收年对年的增速超过三位数。在未来的中国云计算市场上，亚马逊不再是那只搅动市场的小鲶鱼。</p><p><strong>云计算厂商再次拥抱</strong><strong>CDN</strong><strong>公司</strong></p><p>网宿科技与AWS和牵手并非个案，在过去的2018年，经历分分合合之后，云计算厂商和CDN公司再度拥抱。</p><p>2018年5月，微软正式推出了自有的全球CDN网络，但这并不意味着和Akamai分手，与此同时，微软依然为其客户提供了Verizon、Akamai等其他CDN运营商的选择。事实上，这款原生的Azure CDN产品也是由微软和Verizon、Akamai合作推出。</p><p>这是对既有合作关系的升级。早在2015年，微软Azure高调宣布与Akamai达成合作关系，称「透过本次策略合作，Azure CDN 结合 Azure 平台的智慧云端服务与 Akamai 顶尖且大量部署的 CDN 递送优势。」</p><p>这种「自有+第三方厂商」微软模式，目的是方便多CDN 解决方案并排使用，也可以将其分层，以最大限度地提高可靠性和性能，并分摊负载，用户可以专注于优化交付以满足业务需求。</p><p>云计算厂商和CDN公司合作背后的主要原因在于，全球云计算市场、特别是中国云计算市场在付出了长期市场教育成本之后，如今需要收割市场红利，面临盈利的压力，与专业CDN厂商合作不仅可以降低成本、服务也更为可靠。</p><p>一如IBM在其官网对第三方CDN的大力推荐，理由之一是第三方CDN公司可以「提供最全面的 Content Delivery Network 功能，同时保持合理的价格。通过此合作伙伴关系，在超过 50 个国家或地区拥有边缘服务器，使内容最靠近您最需要处在的位置（您的用户）。」</p><p><strong>网宿、</strong><strong>Akamai</strong><strong>们的蝶变升级</strong></p><p>除了优化成本和客户体验之外，网宿、 Akamai在过去几年所经历的蝶变，也极大提升了自身的被合作价值。</p><p>与AWS、Azure、Google Cloud、阿里云、腾讯云等五大巨头分食全球云计算市场类似，全球CDN的市场集中度更高，基本可以概括为「Akamai+网宿科技」的G2模式。当云计算厂商在红海竞争时，CDN的G2已经极为低调地完成了三大扩张：</p><p>其一，从CDN向边缘计算扩张，拿下物联网的入场券；</p><p>Akamai和网宿科技都笃定边缘计算是CDN行业的共同方向和历史机遇。一如Gartner的断言：「云服务商虽然在尽力拓展自己的业务模式，使自己的云更加向边缘拓展。实际上边缘架构的发展是被离用户物理位置最近的技术所驱动。」Akamai大中华区高管曾表示，作为一个已经部署在边缘的技术平台，Akamai早在2003年就与IBM合作边缘计算。在中国，边缘计算的布道者网宿科技也在孜孜不倦地科普和推进边缘计算。考虑到现有的4G网络没有办法支撑整个物联网在基础设施方面的要求，而5G时代，边缘计算恰好能够满足用户对分布式、智能化、低延时、高效率的联网需求。</p><p>其二，从网络加速服务向网络安全扩张；</p><p>CDN厂商最早进入云安全领域，其实是业务增长平稳后开辟的新赛道。在2018年ISC大会的云安全高峰论坛中，全球第二大CDN公司网宿科技正式获批加入全球云安全联盟，不久前，网宿科技宣布与公安部第三研究所签署战略合作协议；Akamai则早在2015年收购安全网络网关（SWG）技术提供商Bloxx公司。随后，其安全厂商的标签逐渐强化，今天，云安全已构成Akamai重要的收入来源。</p><p>其三，从本土市场向国际市场扩张。</p><p>过去几年，网宿科技先后收购了俄CDN运营商CDN-Video、以及在韩国CDN市场占有率排名第一、在日本CDN市场排名第三的CDNetworks，为其国际化铺平了道路，国际化实力大举提升。</p><p>这三大变化，也让CDN厂商在避开与云计算巨头锋芒的同时，蜕变成了全新物种，与AWS、Azure等巨头形成更好的合作互补关系。</p><p><img class="ke_img" src="http://xqimg.imedao.com/168a19155731f5b33fede8b5.jpg" alt="empty"/></p>	4
3041347	网宿科技：副总经理黄莎琳完成减持计划	<p>证券时报e公司讯，网宿科技(300017,诊股)3月22日晚间公告，公司副总经理黄莎琳于3月21日通过大宗交易方式减持公司股份64.3万股，占公司目前总股本的0.0264%，完成3月12日披露的减持计划。目前，黄莎琳持股比例降至0.0794%。</p>	4
3041448	网宿科技：副总经理减持64.3万股	<p>网宿科技(300017,诊股)副总经理黄莎琳于2019年3月21日，通过大宗交易方式减持公司股份643,000股，占公司总股本的0.0264%。黄莎琳的减持计划已实施完毕。</p>	4
3010335	紧急避险！36亿解禁大潮即将来袭，高管集体套现	<p>导读<br/> 　　3月13日，就是最后的逃生机会！<br/> 　　1<br/> 　　公司高管集体套现<br/> 　　3月11日，作为边缘计算概念板块龙头的网宿科技(300017)(300017.SZ)“哑火”了，连续上涨5连板之后，竟然在开盘不久就跳水跌停。<br/> 　　正常来说，这种走势通常出现在市场行情低迷的熊市中，而当日大盘强力反弹，创业板更是大涨超4%。<br/> 　　对于这种情况，小券(ID：quanyeguancha)只能理解为，或许是有先知先觉的大资金知道了一些利空消息，在公司正式公布之前就跑路了。<br/> 　　果然在收盘之后，网宿科技发布公告称，公司的创始人及控股股东陈宝珍拟减持不超1.46亿股，占公司总股本的6%；公司副总经理储敏健，副总经理黄莎琳，董事、副总经理、董秘周丽萍拟合计减持不超821万股，占公司总股本的0.42%。<br/> 　　值得注意的是，网宿科技股价自今年2月以来，已上涨超100%。<br/> 　　实际上，网宿科技的高管自进入今年以来一直处于减持状态，Wind数据显示，光是董事长刘成彦就累计套现约2.4亿元。<br/> 　　网宿科技的高管们如此密集的减持，显然是有预谋的。<br/> 　　数据统计显示，在3月14日，网宿科技将有2.43亿股限售股份解禁，约合解禁市值36亿元，占公司总股本比例的10%，为本周解禁市值最大的A股上市公司。<br/> 　　解禁对象为三年前定向发行对象，包括：兴证资管、九泰基金、博时基金、平安资管、泰康资管等5位。<br/> 　　当时定向发行股份的价格是每股43.95元，在这三年期间，网宿科技进行过多次除权除息，据小券估计，这部分定增股份的成本价目前为15元左右。<br/> 　　像这种纯机构的定增对象，按照以往的情况，在解禁期满后，肯定会二话不说直接就在二级市场上甩货砸盘，尤其是网宿科技在踩上边缘计算的风口之后，股价就像火箭一样向上蹿升，最高曾至17.65元。<br/> 　　就算受昨日大股东减持消息影响，网宿科技今日大幅低开，收盘价仍在15元之上。<br/> 　　可以想象到，上述5家机构所持定增股份的解禁期限一到，在有盈利的情况下，大概率会给网宿科技股价造成很大的抛压。<br/> 　　在这种情况下，网宿科技的高管们在解禁期限到来之前如此密集套现，也就可以理解了。<br/> 　　2<br/> 　　这个热点蹭的刚刚好<br/> 　　之前在宇宙总龙头东方通信(600776)(600776.SH)的带领下，5G板块走出一波高潮，但最开始的时候，各位游资大佬并未看好这只有着5G分支技术概念的个股。<br/> 　　直到3月1日，工信部、国家广播电视总局、中央广播电视总台印发《超高清视频产业发展行动计划(2019-2022年)》。《计划》指出，按照“4K先行、兼顾8K”的总体技术路线，大力推进超高清视频产业发展和相关领域的应用，2022年，我国超高清视频产业总体规模超过4万亿元。<br/> 　　此计划一出，4K超高清概念板块迅速崛起，与此同时还顺便带火了4K超高清概念的衍生分支——边缘计算概念。<br/> 　　很多人可能不理解4K超高清技术和边缘计算技术有什么关系呢？<br/> 　　小券查询资料后大体了解到，现在即使是理想上最高速的光纤网路的传输速度，资料交换还是需要时间，而要想实现4K超高清技术，则需要传输的数据量更是远超以往。<br/> 　　因此需要一种技术来提高传输效率，减少时间延迟，而边缘计算正是因为具备这种特点，所以才成为5G技术体系中不可缺少的一环。<br/> 　　在这种背景下，很早就开始布局边缘计算的网宿科技就搭上了这波行情的顺风车，从3月4日开始爆发，然后莫名地就成为了边缘计算板块的龙头。<br/> 　　对于网宿科技的短期内的大幅上涨，深交所有所质疑，要求公司详细说明边缘计算项目的建设进度、与预期是否一致、已实现和预计实现收入情况，并结合市场发展情况、竞争格局、技术难点及具体应用场景等详细说明公司开展相关业务所面临的风险。<br/> 　　虽然网宿科技的边缘计算概念这个热点并不是临时蹭上去的，但是在巨额定增股份解禁之前，股价突然暴涨，不免令人有些疑虑，而明日可以说是众多小散的最后的逃生机会了。<br/> 　　本文首发于微信公众号：券业观察。文章内容属作者个人观点，不代表和讯网立场。投资者据此操作，风险请自担。</p>	4
3043730	网宿科技股东黄莎琳减持64万股 套现859万元	<p>挖贝网3月24日消息，网宿科技(300017,诊股)股东黄莎琳在深圳证券交易所通过大宗交易方式减持64.3万股，股份减少0.03%，权益变动后持股比例为0.08%。</p><p>截至本公告日，股东黄莎琳在深圳证券交易所通过大宗交易方式完成64.3万股的减持，权益变动前黄莎琳持股0.11%，权益变动后持股比例为0.08%。</p><p>公告显示，本次减持股份均价为13.36元/股，本次减持套现859.05万元。</p><p>公司2018年年度报告显示，2018年公司归属于上市公司股东的净利润为8.04亿元，比上年同期下滑3.16%。</p><p>据挖贝网资料显示，网宿科技致力于互联网和云计算基础设施等方面的关键技术研究，主要业务是在全球范围提供内容分发网络（CDN）、云安全、云计算、互联网数据中心（IDC）等服务。</p><p>来源链接：http://www.cninfo.com.cn/new/disclosure/detail？plate=&orgId=9900008387&stockCode=300017&announcementId=1205930784&announcementTime=2019-03-23</p>	4
2940160	联通携手混改合作伙伴网宿科技合资公司“云际智慧”成立	<p><img class="ke_img" src="http://comment.10jqka.com.cn/sourcepic/12/zajQxcrAvefNextagAtsaytsay.png" alt="empty"/>消息(CWW)2月21日，中国联通（600050）与网宿科技（300017）共同出资成立的云际智慧科技有限公司正式揭牌，并同步发布了三款产品。联通集团董事长王晓初、网宿科技董事长刘成彦、联通集团副总经理梁宝俊等出席了揭牌仪式。作为联通混合所有制改革的新成果，发力5G的重要举措，云际智慧将专注于CDN(Content Delivery Network，内容分发网络)、边缘计算等领域的技术创新，为4K、8K、VR等超高清视频产业，以及人工智能等领域提供CDN以及边缘计算能力，致力于成为5G时代边缘计算能力的提供者,AI时代智慧生活的服务者。</p><p><img class="ke_img" src="http://xqimg.imedao.com/1690efb8494237d53fda0e13.jpg" alt="empty"/></p><p><strong>CDN&边缘计算市场空间巨大</strong></p><p>2019年春晚，中国首次成功实现4K超高清电视5G网络传输测试。伴随着5G技术的突飞猛进，以及信息消费、VR/AR产业的兴起，信息视频化、视频超高清化已经成为信息产业发展的大趋势。从增长情况和规模来看,据Cisco发布的数据，2016-2021年，全球互联网视频流量年复合增长率达31%；从技术演进来看,视频已经从标清、高清进入4K,甚至即将进入8K超高清时代,并且逐步向AR、VR、全息进一步演进，高清视频等产业的发展为CDN行业带来了全新的发展机遇。</p><p>来自MarketsandMarkets的CDN市场研究预计，CDN服务将从2017年的75亿美元增长到五年后的300亿美元。同时，据IDC数据显示，预计到2020年，全球将接入超过500亿的终端与设备联网，企业物联网目前占总联网终端市场存量的52%，超过40%的数据要在网络边缘侧进行分析、处理与存储。在新一代信息技术革命浪潮下，边缘计算已经成为CDN服务商下一场角逐的关键点，为CDN行业打开巨大的市场空间。TrendForce最新预测显示，边缘计算产品和服务市场在2018年至2022年将以复合年增长率超过30%的速度增长，这一增速有望带来千亿级美元的市场空间。</p><p>联通集团副总经理梁宝俊表示,中国联通积极落实国家网络强国、数字中国战略部署，紧抓混合所有制改革的历史机遇期，以“技术转型”为突破，大力布局5G、人工智能、物联网、工业互联网等领域，着力打造5G时代下的新一代CDN及边缘计算能力。云际智慧的成立，是中国联通构建新一代智能化网络的重要战略部分。通过运营商基础网络与CDN的紧密结合，将极大的促进互联网内容及应用的创新，加速赋能产业发展，推动企业数字化转型升级。</p><p>网宿科技董事长刘成彦表示，即将到来的5G与物联网、AR/VR、超清/互动视频、大数据人工智能的融合，将会创造出三大应用场景：即超大移动宽带、海量机器类通信和超低延时高可靠传输，这三大应用场景都需要大量的边缘计算。CDN是边缘计算的一部分能力，其与生俱来的边缘节点属性，令CDN服务提供商在边缘计算市场具备先发优势。网宿愿意利用在CDN业务中积累的技术、产品、运营经验，全力支持云际智慧的发展。</p><p><strong>云际智慧竞争优势明显</strong></p><p>据悉，云际智慧将作为中国联通唯一的商用CDN产品运营支撑平台，其将充分整合联通强大的基础网络、遍布全国的营销服务体系，以及网宿在CDN领域领先的技术研发和运营能力，着力打造新一代的CDN网络应用基础设施。通过CDN节点下沉，让内容及应用更靠近用户，将CDN和计算扩展到边缘，面向5G时代，打造出最具市场竞争力的CDN及边缘计算服务。未来，云际智慧还将构建能力开放平台，面向云计算、互联网、政府、金融、制造等诸多行业及领域，提供CDN及边缘计算能力开放。</p><p>云际智慧董事长温宁瑞表示，云际智慧的成立是联通混改战略中具有突破意义的一次的尝试，所实行的创始人制度和股权激励机制，能够充分聚集人才，并激发其积极性，实现自主创新，驱动发展。此外，在中国联通进行网络转型探索过程中，云际智慧的CDN能力将于联通的边缘云紧密结合，以“边”为触点，实现“云、网、边”协同的一体化服务体系，赋能垂直行业。</p><p>目前云际智慧已经完成了CDN节点下沉技术方案验证，在网络访问速度和性能提升方面十分明显。双方的合作这盘大棋，将对CDN及边缘计算产业的发展带来深远影响。</p><p>据悉，云际智慧于2019年1月29日核准成立，注册资本5亿。其中，网宿科技持有42.5%的股权；联通创投持有42.5%的股权；网智通持有云际智慧15%的股权。</p>	4
2941135	中国联通晒混改新成果：携网宿科技成立云际智慧	<p><img class="ke_img" src="http://xqimg.imedao.com/1690fc5261f259cf3fd04f04.jpg" alt="empty"/></p><p>现场揭牌仪式。中新网 吴涛 摄</p><p>中新网客户端北京2月21日电(记者 吴涛)21日，中国联通与网宿科技共同出资成立的云际智慧科技有限公司正式揭牌，并同步发布了三款产品。</p><p>据了解，云际智慧于2019年1月29日核准成立，注册资本5亿元。其中，网宿科技持有42.5%的股权，联通创投持有42.5%的股权，网智通持有云际智慧15%的股权。</p><p>作为联中国通混合所有制改革的新成果，发力5G的重要举措，云际智慧将专注于CDN(内容分发网络)、边缘计算等领域的技术创新，为4K、8K、VR等超高清视频产业，以及人工智能等领域提供CDN以及边缘计算能力。</p><p>网宿科技董事长刘成彦表示，即将到来的5G与物联网、AR/VR、超清/互动视频、大数据人工智能的融合，将会创造出三大应用场景：即超大移动宽带、海量机器类通信和超低延时高可靠传输，这三大应用场景都需要大量的边缘计算。</p><p>“CDN是边缘计算的一部分能力，其与生俱来的边缘节点属性，令CDN服务提供商在边缘计算市场具备先发优势。网宿愿意利用在CDN业务中积累的技术、产品、运营经验，全力支持云际智慧的发展。” 刘成彦说。</p><p>资料显示，CDN边缘计算市场空间巨大，来自MarketsandMarkets的CDN市场研究预计，CDN服务将从2017年的75亿美元增长到五年后的300亿美元。</p><p>同时，据IDC数据显示，预计到2020年，全球将接入超过500亿的终端与设备联网，企业物联网目前占总联网终端市场存量的52%，超过40%的数据要在网络边缘侧进行分析、处理与存储。(完)</p>	4
2942012	联通与网宿科技设立合资公司 瞄准下一代CDN技术	<p><img class="ke_img" src="https://pifm.eastmoney.com/EM_Finance2014PictureInterface/Index.aspx?id=3000172&imageType=k&token=28dfeb41d35cc81d84b4664d7c23c49f&at=1" alt="empty"/></p><p><img class="ke_img" src="https://pifm.eastmoney.com/EM_Finance2014PictureInterface/Index.aspx?id=3000172&imageType=k&token=28dfeb41d35cc81d84b4664d7c23c49f&at=1" alt="empty"/></p><p>中国联通与网宿科技筹备数月的CDN合资公司宣告成立，2月21日，云际智慧科技有限公司(下称云际智慧)正式揭牌，并同步发布了三款产品。</p><p>记者了解到，云际智慧将专注于CDN(内容分发网络)、边缘计算等领域的技术创新，为4K、8K、VR等超高清视频产业，以及人工智能等领域提供CDN以及边缘计算能力。云际智慧的成立被视为联通混合所有制改革的新成果，也是联通发力5G的重要举措。</p><p><strong>瞄准下一代CDN技术</strong></p><p>联通集团副总经理梁宝俊表示，云际智慧的成立，是中国联通构建新一代智能化网络的重要战略部分。通过运营商基础网络与CDN的紧密结合，将极大的促进互联网内容及应用的创新，加速赋能产业发展，推动企业数字化转型升级。</p><p>目前，云际智慧已经完成了CDN节点下沉技术方案验证，在网络访问速度和性能提升方面十分明显。双方此次合作，也将对CDN及边缘计算产业的发展带来深远影响。</p><p>云际智慧副董事长孙孝思在接受记者采访时表示，下一代CDN首先就是要将节点下沉到城域网，其次是面向超高清视频产业提供更优质的内容分发能力。“4K、8K、VR都是超高清视频的典型应用，随着5G的商用，超高清视频产业的增长会比较快，CDN节点下沉之后，可以极大提高超高清视频用户的访问体验，流畅度、清晰度都会有很大提高。”</p><p>当然，从云际智慧目前的策略来看，会重点关注超高清视频等成熟的大流量应用场景。但并不意味着云际智慧不会拓展其它业务范畴，孙孝思告诉记者，云际智慧将在2019年实施边缘计算能力的储备，等到2020年5G商用后，再把下沉的CDN节点进行边缘计算能力的改造、优化、升级。</p><p>“这个时候，就可以面向更多的应用场景提供边缘计算能力，如视频监控，智慧城市、云VR等。”孙孝思表示，云际智慧在这方面的考虑是，只有当应用场景的市场需求成熟后才可以提供服务，不同阶段提供不同的能力，这样的步骤才会和市场发展趋势契合，公司发展也才会更加稳健。</p><p>据IDC数据显示，预计到2020年，全球将接入超过500亿的终端与设备联网，企业物联网目前占总联网终端市场存量的52%，超过40%的数据要在网络边缘侧进行分析、处理与存储。在新一代信息技术革命浪潮下，边缘计算已经成为CDN服务商下一场角逐的关键点。</p><p>作为此次合作的另一方，网宿科技董事长刘成彦表示，CDN是边缘计算的一部分能力，其与生俱来的边缘节点属性，令CDN服务提供商在边缘计算市场具备先发优势，同时，网宿科技愿意利用在CDN业务中积累的技术、产品、运营经验，全力支持云际智慧的发展。</p><p><strong>联通混改出新招</strong></p><p>云际智慧的成立被视为联通混合所有制改革的新成果，目前已经明确将云际智慧作为中国联通唯一的商用CDN产品运营支撑平台，其将充分整合联通强大的基础网络、遍布全国的营销服务体系，以及网宿在CDN领域领先的技术研发和运营能力，着力打造新一代的CDN网络应用基础设施。</p><p>记者了解到，目前，中国移动正在依靠自身力量开拓CDN业务，中国电信也曾经和CDN公司合作CDN产品的代售转售。云际智慧成立后，联通将拥有自主的CDN产品，这在运营商业务结构转向的当下无疑有重要意义。</p><p>孙孝思告诉记者，从中国联通角度来看，之前联通就有IDC(数据中心)产品，现在通过云际智慧多了自有的CDN产品，这就能够更好促进产品之间的整合；一个明显的优势是，CDN和IDC的客户群体是一致的，这样可以提高中国联通的创新产品能力。</p><p>另一方面，孙孝思认为，对于整个CDN行业而言，专业CDN公司如果要建立像中国联通一样庞大的市场营销团队，其成本是非常高的，但是云际智慧可以利用联通的营销渠道，这就极大地打开了CDN的市场覆盖。“这样可以让更多的国内互联网用户和企业用户享受到更优质的CDN服务，促进中国互联网内容与应用的发展。”</p><p>值得一提的还有，云际智慧采取了更为灵活的体制机制。云际智慧董事长温宁瑞表示，云际智慧的成立是联通混改战略中具有突破意义的一次尝试，所实行的创始人制度和股权激励机制，能够充分聚集人才，并激发其积极性，实现自主创新，驱动发展。</p><p>工商资料显示，云际智慧股东中，网宿科技、联通创投分别持有42.5%的股权，作为员工持股平台的网智通持有15%股权，主要管理人员也分别来自网宿科技或中国联通。孙孝思表示，云际智慧创立之初就考虑到员工激励机制设置的问题，股权激励等制度设计也能够更好聚集人才，发挥人才主动性，使公司更具市场竞争力。</p>	4
