id	title	text	score
2940212	“云际智慧”公司成立 专注打造下一代CDN与边缘计算平台	<p>【TechWeb】2月21日，中国联通与网宿科技共同出资成立的云际智慧科技有限公司正式揭牌， 联通集团董事长王晓初、网宿科技董事长刘成彦、联通集团副总经理梁宝俊等出席了揭牌仪式。</p><p><img class="ke_img" src="http://xqimg.imedao.com/1690f069736235f53fe669c7.jpg" alt="empty"/></p><p>作为联通混改战略中具有突破意义的一次的尝试，新公司未来专注两件事情:一是打造下一代CDN平台，另一个是自主研发边缘计算平台。</p><p>伴随着5G技术的突飞猛进，以及信息消费、VR/AR产业的兴起，信息视频化、高清化已成为大势所趋，产业的蓬勃发展为CDN行业带来了全新的发展机遇。</p><p>据IDC数据显示，预计到2020年，全球将接入超过500亿的终端与设备联网，企业物联网目前占总联网终端市场存量的52%，超过40%的数据要在网络边缘侧进行分析、处理与存储。</p><p>联通集团副总经理梁宝俊表示, 中国联通积极落实国家网络强国、数字中国战略部署，紧抓混合所有制改革的历史机遇期，以“技术转型”为突破，大力布局5G、人工智能、物联网、工业互联网等领域，着力打造5G时代下的新一代CDN及边缘计算能力。</p><p>据悉，云际智慧将作为中国联通唯一的商用CDN产品运营支撑平台，其将充分整合联通强大的基础网络、遍布全国的营销服务体系，以及网宿在CDN领域领先的技术研发和运营能力，着力打造新一代的CDN网络应用基础设施。</p><p>未来，云际智慧还将构建能力开放平台，面向云计算、互联网、政府、金融、制造等诸多行业及领域，提供CDN及边缘计算能力开放。</p><p>资料显示，云际智慧于2019年1月29日核准成立，注册资本5亿。其中，网宿科技持有42.5%的股权；联通创投持有42.5%的股权；网智通持有云际智慧15%的股权。</p>	2
2940372	联通混改新进展：携手网宿科技成立合资公司 发力CDN、边缘计算	<p>中国联通（600050）与混改伙伴有了新的合作。</p><p>2月21日，由中国联通与网宿科技（300017）共同出资成立的云际智慧科技有限公司正式揭牌，并同步发布了三款产品。据悉，云际智慧的成立是联通混合所有制改革的新成果，同时也是发力5G的重要举措。未来，云际智慧将专注于CDN(Content Delivery Network，内容分发网络)、边缘计算等领域的技术创新，为4K、8K、VR等超高清视频产业，以及人工智能等领域提供CDN以及边缘计算能力。</p><p>据悉，云际智慧将作为中国联通唯一的商用CDN产品运营支撑平台，并将充分整合联通的基础网络、遍布全国的营销服务体系，以及网宿在CDN领域领先的技术研发和运营能力，着力打造新一代的CDN网络应用基础设施。通过CDN节点下沉，让内容及应用更靠近用户，将CDN和计算扩展到边缘，面向5G时代，打造出最具市场竞争力的CDN及边缘计算服务。</p><p>未来，云际智慧还将构建能力开放平台，面向云计算、互联网、政府、金融、制造等诸多行业及领域，提供CDN及边缘计算能力开放。</p><p>据Cisco发布的数据，2016-2021年，全球互联网视频流量年复合增长率达31%；从技术演进来看,视频已经从标清、高清进入4K,甚至即将进入8K超高清时代,并且逐步向AR、VR、全息进一步演进，高清视频等产业的发展为CDN行业带来了全新的发展机遇。</p><p>云际智慧董事长温宁瑞表示，云际智慧的成立是联通混改战略中具有突破意义的一次的尝试。据介绍，云际智慧于2019年1月29日核准成立，注册资本5亿。其中，网宿科技持有42.5%的股权；联通创投持有42.5%的股权；网智通持有云际智慧15%的股权。目前云际智慧已经完成了CDN节点下沉技术方案验证。</p>	2
2992506	边缘计算概念持续强势 网宿科技四连板	<p>证券时报e公司讯，边缘计算概念今日开盘持续强势，安控科技(300370,诊股)、京蓝科技(000711,诊股)、网宿科技(300017,诊股)、依米康(300249,诊股)等多股涨停。其中，网宿科技连续四日涨停。边缘计算近日成为市场上炙手可热的题材，边缘计算作为5G和高清时代核心网下沉的一种方式，其主要价值在于减少超大流量对网络的消耗，同时为各种应用提供低延时和开放的网络能力。</p>	2
3013671	【神评】网宿科技股价两周翻倍 股东、高管拟减持 网友：又一朵奇葩	<p><strong>【新闻】网宿科技股价两周翻倍 四股东高管拟减持6%</strong></p><p>据长江商报报道，边缘计算概念龙头股网宿科技在股价大涨的时刻遭股东及高管减持。3月11日晚间，网宿科技公告称，公司第一大股东及3名董监高拟合计减持6.42%公司股份。上述股东及高管减持正处于公司股价上涨时期，今年3月以来，边缘计算概念面临风口，网宿科技在2月21日至3月8日约两周时间，股价由8.86元涨至17.29元，股价翻倍，3月4日至3月8日更是连续5天涨停。网宿科技的业绩曾在2015年达到高峰，净利润和营收维持着50%以上的高增速，但从2015年开始，业绩出现滑坡，营收和净利润的增长速度放缓。</p><p>对于边缘计算项目，深交所在3月7日曾下发了关注函，要求网宿科技详细说明边缘计算项目具体情况。补充说明公司董监高及持股5%以上股东近一个月是否存在买卖公司股票的情况，是否存在内幕交易或操纵股价的情形。但截至记者截稿时，网宿科技仍未能对上述关注给出答复。网宿科技董秘办人士对此表示，“边缘计算项目仍处于前期建设阶段，存在较多的不确定因素。”</p><p><strong>【神评】</strong></p><p>网友：股市的又一朵奇葩</p><p><img class="ke_img" src="http://5b0988e595225.cdn.sohucs.com/images/20190313/2909a0d4fd2649d7b321a4791cd8e150.gif" alt="empty"/></p><p>网友：这届股民爱接盘</p><p><img class="ke_img" src="http://xqimg.imedao.com/16976ae3a811af843fcfc4f8.jpeg" alt="empty"/></p><p>网友：好吃好喝就算了，还打包带走</p><p><img class="ke_img" src="http://xqimg.imedao.com/16976ae3b721af853fa8b050.jpeg" alt="empty"/></p><p>网友：还好跑得快</p><p><img class="ke_img" src="http://xqimg.imedao.com/16976ae3c521b2e73fe97cd2.png" alt="empty"/></p><p><strong>【新闻】迪士尼以713亿美元收购福克斯</strong></p><p>据每日经济新闻报道，13日，迪士尼宣布其以713亿美元收购福克斯部分资产的交易已获最后监管批准，将于美东时间3月20日上午12：02正式完成。这笔交易在去年6月27日就已经获得美国反垄断部门的批准，但包括欧盟和中国政府在内的其他国家监管部门的批准经历了长达半年的相关运作后，迪士尼正式宣布已获得最后的监管批准。交易完成后，已经坐拥皮克斯动画工作室、漫威影业以及《星球大战》制片商卢卡斯影业的迪士尼，将把《X战警》、《阿凡达》、《泰坦尼克号》等著名影视版权收入麾下。好莱坞新的格局将是：迪士尼，AT&T，Netflix，环球，索尼，派拉蒙。未来观众看到的80%的国外电影将由这些电影公司制作发行。</p><p><strong>【神评】</strong></p><p>网友：原来米老鼠才是大哥</p><p><img class="ke_img" src="http://xqimg.imedao.com/16976ae3cfb1b2e83fe3c326.jpeg" alt="empty"/></p><p>网友：这钱说着玩似的</p><p><img class="ke_img" src="http://5b0988e595225.cdn.sohucs.com/images/20190313/6b8b2f9f685942b4addad4ca96082bd2.gif" alt="empty"/></p><p>网友：X战警VS复联指日可待</p><p><img class="ke_img" src="http://xqimg.imedao.com/16976ae3df91af873fe95cdc.jpeg" alt="empty"/></p><p>网友：我能投反对票吗</p><p><img class="ke_img" src="http://xqimg.imedao.com/16976ae3f9a1acb03fb2fba5.jpeg" alt="empty"/></p><p><strong>【新闻】宝洁在巴黎退市！销量暴跌、品牌老化……时代已经变了</strong></p><p>据海峡网报道，近日，美国日化巨头宝洁公司发布声明称，将从巴黎泛欧证券交易所（Euronext）退市，宝洁公司在该交易所的股份将于2019年4月4日起从法国欧洲清算所中删除。宝洁股票将继续在美国纽交所上市。 “宝洁公司突然宣布退市，不但跟公司屡次改革失利和瘦身计划有关，而且还跟公司持续到退的业绩有直接的联系。” 有业内人观察人士对记者分析说，特别是业绩的持续低迷，留在泛欧交易所反而拖累公司。</p><p>宝洁在巅峰时期的2008年、2011年以及2012年这三年，营收都达到800亿美元之高。从2013年以后，从来都是吃平价红利的宝洁，变成了吃亏，销售额已处于停滞不前的状态。为了应对品牌老化问题，2016年，宝洁将200多个品牌矩阵缩减至60多个，并且开始走高端化路线。但仍旧没有挽救颓势，到了2018年营收只有668.32亿美元了。这样的成绩甚至还不如宝洁在2006年的营收。2018年11月，宝洁公司就已经宣布将公司结构进行重组，将业务部门从10个削减至6个，这些变化将于2019年7月1日起生效。</p><p><strong>【神评】</strong></p><p>网友：要不来我A股吧</p><p><img class="ke_img" src="http://xqimg.imedao.com/16976ae40601b2ea3fea2c40.jpeg" alt="empty"/></p><p>网友：反正不影响我使用</p><p><img class="ke_img" src="http://5b0988e595225.cdn.sohucs.com/images/20190313/d442bab2b6424eedb05122f9f7e769da.gif" alt="empty"/></p><p>网友：SKⅡ还不是年年涨</p><p><img class="ke_img" src="http://xqimg.imedao.com/16976ae429f1af893fe433e8.jpeg" alt="empty"/></p><p>网友：虽然跑慢了，可是你们还是追不上</p><p><img class="ke_img" src="http://xqimg.imedao.com/16976ae434e1acb23fd11340.jpeg" alt="empty"/></p><p>免责声明：本文内容及观点仅供参考，不构成任何投资建议，投资者据此操作，风险自担。股市有风险，入市需谨慎。</p><p>实时行情、7*24资讯追踪、热点解读……一站式贴心投资服务，尽在腾讯财讯微信公众号（qqstock）。</p>	2
2993823	深耕云服务布局物联网 华胜天成将受益边缘计算	<p>近期，受益边缘计算火热，相关概念股持续大涨。3月7日，边缘计算板块内网宿科技(300017,诊股)（300017.SZ）、依米康(300249,诊股)（300249.SZ）等个股已经连续四天涨停，东土科技(300353,诊股)（300353.SZ）、浪潮信息(000977,诊股)（000977.SZ）、华胜天成(600410,诊股)（600410.SH）等个股涨幅也较为显著。</p><p>5G有低时延、高可靠的通信要求，边缘计算将成为必然选择。据IDC预测，2020年将有超过500亿的终端与设备联网，而有50%的物联网网络将面临网络带宽的限制，40%的数据需要在网络边缘分析、处理与储存。分析人士表示，边缘计算市场规模将超万亿，成为与云计算平分秋色的新兴市场。</p><p><strong>移动边缘计算与云计算相得益彰 提升用户体验</strong></p><p>边缘计算和云计算具备协同效应，通过将边缘计算与云计算相结合，使边缘节点聚焦于实时、短周期的数据处理，而中心节点聚焦于非实时、长周期的数据处理，如此一来可以极大地缓解网络带宽与数据中心压力，同时增强服务请求的响应能力。</p><p>根据相关资料显示，移动边缘计算当初架构的设想是将整个云计算大平台的核心网网元迁移至靠近终端的边缘，使得IT和云平台的运算能力向靠近终端的地方下沉，融合网络传输、计算、储存和应用的创新能力，来提高边缘“小计算”的反馈和效率。</p><p>移动边缘计算具备邻近性、低时延、减少网络堵塞、位置认知等诸多优势，邻近性，使得移动边缘计算服务器非常靠近信息源，因此能很方便地捕捉关键信息，还能直接访问客户的设备；低时延，移动边缘计算能在用户设备或者设备附近的计算服务器进行数据处理，所以能较快地将处理结果传送到客户的设备上，大大降低传输时间，提高用户体验度；减少网络堵塞，由于移动边缘计算服务器靠近信息源，可以对数据进行处理后直接把结果传输到云计算中心，不需要附带原始数据，能减少网络堵塞，提高传输速度和效率；位置认知，使用移动边缘计算能利用较少的信息来确定每一个用户设备的位置。增强现实、无人机、医疗保健、智能交通等领域存在大量的低时延场景，对移动边缘计算有客观需求，随着 5g 与人工智能时代的来临，移动边缘计算的发展潜力十分巨大。</p><p><strong>产业链上游相关基础设施及硬件厂商将受益</strong></p><p>5G时代的多元化应用催生了边缘计算的快速发展，边缘计算产业链由“软硬件提供商-边缘计算服务运营商-应用开发商”构成。当前存量的云计算、物联网技术通过与边缘计算结合，将显著提升对于高要求场景需求的支撑能力。</p><p>根据中信证券(600030,诊股)研报显示：在边缘计算投资机遇方面，一是基础设施先行，边缘节点作为架构中核心增量有望率先收益，四类节点形态中重点推荐服务器领域；二是边缘服务商兵家必争；三是下游基于边缘计算服务的应用厚积薄发，关注制造领域。</p><p>国金证券(600109,诊股)通信分析师唐川认为，当前国内边缘计算的发展处于早期阶段，配套基础设施及硬件尚不完善，以阿里为首的云计算巨头推出的边缘计算平台尚未大规模普及，相关应用及服务提供商仍以初创公司为主，因此现阶段建议重点关注产业链上游的相关基础设施及硬件厂商。</p><p>根据券商观点和上市公司公告，笔者整理出部分相关标的。</p><p>浪潮信息（000977.SZ）</p><p>浪潮信息主要从事云计算、大数据服务业务，涵盖云数据中心、云服务大数据、智慧城市、智慧企业等产业群组。</p><p>边缘计算带来的增量计算需求预计将推动运营商的服务器采购量大幅提升，公司不但是三大运营商OTII边缘服务器标准的核心成员，更在2019年2月25日世界移动通信大会发布首款基于OTII标准的边缘计算服务器NE5260M5，该产品专为5G设计，可承担物联网、MEC和NFV等5G应用场景。</p><p>网宿科技（300017.SZ）</p><p>网宿科技是一家互联网业务平台提供商，满足客户在IT部署及数据计算、传输、安全等方面的需求。</p><p>公司已进行业务布局，首期投入3亿元建设“面向边缘计算的支撑平台”项目，打造智能网络，深度参与并助力智能社会发展。未来，公司将重点聚焦在CDN、云安全、云计算以及边缘计算的技术研发及业务开拓。</p><p>华胜天成（600410.SH）</p><p>华胜天成在IT行业解决方案领域，有着深厚的积累，在智慧零售、智慧物流、智慧环保、智能安监、智慧旅游等领域经验丰富。</p><p>华胜天成深耕云计算市场，并随着市场发展，积极布局物联网和人工智能，打造“连接＋平台＋智能”的价值平台。公司推出的“天成云”品牌融合了华胜天成的软件、IT服务、系统及产品，提供“一站式”云服务。根据公开资料显示，华胜天成与北京科技大学合作的面向异构通信环境的云计算资源管理关键技术及IaaS系统应用获得北京市科学技术奖三等奖。该技术提出了一种边缘计算云无线接入资源动态管理模型，实现了无线信道资源的公平分配。该成果获发明专利5项、软件着作权4项。</p>	2
3097056	网宿科技副总裁李东：边缘计算迎来应用快速发展期	<p>DoNews 4月10日消息（记者 赵晋杰）市场研究机构Technavio预测，从2018年到2022年，全球边缘计算技术应用量将以每年近20%的速度增长。</p><p>网宿科技副总裁李东在4月10日举行的2019亚太CDN峰会上表示，未来五年边缘计算将爆发出巨大的技术创新力，将真正解决百亿甚至千亿设备联网的问题，加速推动物联网落地，从而进入真正的智能社会。</p><p>加速边缘计算崛起的正是它巨大的市场空间。据国际知名数据分析公司Statista预测，作为边缘计算的重要应用市场，物联网的市场规模有望在2020年达到9万亿美元。来自咨询研究机构Juniper Research最新研究显示，到2023年，物联网将有460亿活跃的工业连接。欧洲边缘计算联盟（ECCE）预计，在边缘处理的数据量将继续快速增长，到2025年，75%的企业生成的数据将在数据中心或云之外创建和处理。</p><p><img class="ke_img" src="http://xqimg.imedao.com/16a078c288448c9a3fd8a3fe.jpg" alt="empty"/></p><p>这一新技术在亚太地区的发展尤为迅速。Grand View Research预测，2016-2025年期间亚太区边缘计算市场的复合增长率将高达46.7%。在国内，以华为为代表的设备厂商、以网宿科技为代表的CDN厂商以及一众云厂商等都在加大对该领域的布局。</p><p>不同类型的市场参与者们都期待通过各自的技术路径布局边缘计算，以抢占市场先机。但业内人士表示，现实是并非所有入局者都站在同一起跑线，部分玩家在技术上的优势已经凸显。</p><p>Linux基金会在近期发布的《开放的边缘计算术语表》里将边缘分为基础设施边缘、访问边缘和聚合边缘三个层次，其中对“聚合边缘”的描述完全符合CDN网络的特征——“由位于单个位置的中型数据中心组成，也可能由多个相互连接的微型数据中心组成。”</p><p>“聚合边缘（CDN）将是企业的首选。”知名应用程序交付平台提供商Apcela的CEO Mark Casey在对边缘计算的部署位置的选择问题上提出这样的观点。</p><p>网宿科技副总裁李东在2019年的亚太CDN峰会上表示，过去十几年互联网的繁荣发展，CDN主要是在靠近应用端提供了以传输为主的网络服务，随着万物互联时代的到来，新的应用一定会出现，这对CDN也提出更高的要求，“我们必须要适应市场需求的升级，在接近应用端顺势提供以计算为主、网络为辅的边缘计算服务。我们的技术积淀以及服务经验，将为我们在这场技术变革中赢得更有利的起跑线”。</p><p>据了解，相较于云计算以云主机为主的虚拟化技术，边缘计算对隔离性要求更高，尤其是车联网等时延敏感性应用，更需要与之匹配的隔离技术。而容器技术因更符合海量设备在边缘启动要求更快、部署要求更轻便、隔离效果更好的需求，在边缘计算时代具备更广泛的应用场景和范围。</p><p><img class="ke_img" src="http://xqimg.imedao.com/16a078c2a464900e3fc01f18.jpg" alt="empty"/></p><p>据了解，作为全球第二大CDN服务商，网宿科技早在去年就推出边缘计算平台，融合容器等虚拟化技术，持续接入客户，并紧跟客户需求完善相关产品。针对边缘计算所需要的网络架构核心环节，网宿还携手中国联通成立合资公司云际智慧，推动部署边缘节点进一步下沉，从而承接未来。（完）</p>	3
2941448	中国联通携手网宿科技 拟抢占5G内容分发领域	<p>2月21日，中国联通（600050）与网宿科技（300017）共同出资成立的云际智慧科技有限公司(下称“云际智慧”)正式揭牌。</p><p>企查查显示，云际智慧成立于2019年1月29日，注册资本5亿元。其中，网宿科技持有42.5%的股权，认缴出资2.125亿元;联通创投持有42.5%的股权，认缴出资2.125亿元;网智通持有云际智慧15%的股权,认缴出资7500万元。</p><p>中国联通相关负责人对《国际金融报》记者表示，云际智慧将专注于CDN、边缘计算等领域的技术创新，为4K、8K、VR等超高清视频产业，以及人工智能等领域提供CDN以及边缘计算能力。</p><p>通信专家张弛在接受《国际金融报》记者采访时分析称，所谓CDN，是Content Delivery Network的英文缩写，意为内容分发网络，是5G核心网络技术之一。张弛表示，此次双方合作成立合资公司，主要是面向5G，在8K、VR、AR等互联网内容分发领域抢占先发优势。</p><p>据悉，随着5G时代的到来，信息视频化、视频超高清化已经成为信息产业发展的大趋势。从增长情况和规模来看,Cisco发布的数据显示，2016-2021年，全球互联网视频流量年复合增长率达到31%;从技术演进来看，视频已经从标清、高清进入4K，甚至即将进入8K超高清时代，并且逐步向AR、VR、全息进一步演进，高清视频等产业的发展为CDN行业带来了全新的发展机遇。</p><p>另据MarketsandMarkets的CDN市场研究预计，CDN服务将从2017年的75亿美元增长到五年后的300亿美元。这意味着，在新一代信息技术革命浪潮的影响下，以CDN为代表的内容分发网络市场将存在巨大的发展空间。</p><p>张弛认为，中国联通联合网宿科技成立合资公司，看中的正是未来5G时代的内容市场。“自4G，甚至3G时代开始，有关运营商的定位就一直被业界讨论。有一种观点认为，运营商只要做好管道就行，不要做内容和经营，到现在这种舆论仍旧存在。然而，对运营商来说，内容业务才是真正盈利的方向。”</p><p>张弛表示，从中国联通的角度来看，这次合作就是想在5G内容领域找到新的盈利增长点。</p><p>网宿科技方面此前发布公告表示，本次合作结合了国有企业的业务资源和民营企业的技术服务优势，网宿科技与中国联通将利用各自的业务能力和产业优势，通过合资公司推动CDN产品升级，从而增强公司的核心竞争力和行业影响力。</p><p>(国际金融报记者汪建君编辑沈玉洁)</p>	3
3382827	网宿科技旗下CDNetworks首次被Gartner评为全球级CDN服务商	<p>原标题：网宿科技旗下CDNetworks首次被Gartner评为全球级CDN服务商 来源：中国新闻网</p><p>中新网7月16日电 据韩联社报道，独立咨询机构Gartner日前发布最新全球CDN服务市场指南《Market Guide for CDN Services》显示，网宿科技旗下子公司CDNetworks凭借全球服务能力和产品技术优势，首次被评为全球级(Global)服务商，面向全球五大洲提供中立、优质、稳定的网络连接服务。</p><p>据Gartner报告，CDNetworks总部位于韩国首尔，拥有代表多个垂直领域和地理区域的多样化客户群，在45个国家部署了169个CDN节点，容量为10 Tbps。与此同时，该公司在印度、南美和俄罗斯等新兴市场也部署了CDN节点，加之母公司网宿科技(持有CDNetworks 97.82%的股权)在大中华区及全球范围内布局的海量CDN及安全节点资源，CDNetworks能够同时覆盖成熟及新兴市场，并保证高效、稳定的服务质量。</p><p>Gartner称，CDNetworks产品覆盖了传统的web性能和加速，以及先进的安全产品，包括爬虫缓解、抗DDoS和知识产权声誉管理等。</p><p>Gartner此次报告核心观点也指出，未来寻求CDN服务的组织需要的是在一个易于部署和操作的包中包含多个捆绑的功能，尤其是分布式拒绝服务(DDoS)保护、爬虫管理和云web应用程序防火墙(WAFs)，对安全控制的要求越来越高，对配置选项的粒度要求越来越高。这也正是CDNetworks及其母公司网宿科技重点发力云安全的原因之一。</p><p>据悉，CDNetworks的母公司网宿科技此次被Gartner评级为Regional，可面向全球三大洲提供CDN服务。同样来自中国的另外三家大型厂商中阿里云和腾讯云均被评为Regional，白山云被评为National，可面向中国国内提供CDN服务。</p>	3
